{
  "$schema": "https://raw.githubusercontent.com/jihedbfr-art/jihedbfr-art/main/schemas/skills-index.schema.json",
  "version": "1.0.0",
  "generated_at": "2026-10-23T02:56:25Z",
  "owner": {
    "name": "Jihed Ben Arfa",
    "org": "JihedAiLabs",
    "github": "jihedbfr-art"
  },
  "languages": [
    "en",
    "fr"
  ],
  "repositories": [
    {
      "id": "ai-skills",
      "url": "https://github.com/jihedbfr-art/ai-skills",
      "kind": "knowledge-base",
      "domains": [
        "agents",
        "ai-engineering",
        "guardrails",
        "llm",
        "mcp",
        "prompt-engineering",
        "rag",
        "spring-ai",
        "vector-database",
        "ai-agents",
        "anthropic",
        "claude",
        "llm-engineering"
      ],
      "entry_points": {
        "human": "README.md",
        "agent": "README.md"
      },
      "languages": [
        "en",
        "fr"
      ],
      "status": "active"
    },
    {
      "id": "bpmn-provisioning-patterns",
      "url": "https://github.com/jihedbfr-art/bpmn-provisioning-patterns",
      "kind": "knowledge-base",
      "domains": [
        "bpmn",
        "camunda",
        "kafka",
        "spring-boot",
        "telecom",
        "saga-pattern",
        "event-driven-architecture",
        "java",
        "microservices",
        "orchestration"
      ],
      "entry_points": {
        "human": "README.md",
        "agent": "README.md"
      },
      "languages": [
        "en",
        "fr"
      ],
      "status": "active"
    },
    {
      "id": "component-manifest-lint",
      "url": "https://github.com/jihedbfr-art/component-manifest-lint",
      "kind": "library",
      "domains": [
        "bilingual",
        "kubernetes",
        "linter",
        "manifest-validation",
        "python",
        "telecom",
        "yaml",
        "sarif"
      ],
      "entry_points": {
        "human": "README.md",
        "agent": "README.md"
      },
      "languages": [
        "en",
        "fr"
      ],
      "status": "active"
    },
    {
      "id": "cyber-skills",
      "url": "https://github.com/jihedbfr-art/cyber-skills",
      "kind": "knowledge-base",
      "domains": [
        "appsec",
        "awesome",
        "blue-team",
        "cloud-security",
        "cybersecurity",
        "infosec",
        "pentesting",
        "red-team",
        "security",
        "security-skills",
        "devsecops",
        "incident-response",
        "owasp",
        "threat-intelligence"
      ],
      "entry_points": {
        "human": "README.md",
        "agent": "README.md"
      },
      "languages": [
        "en",
        "fr"
      ],
      "status": "active"
    },
    {
      "id": "dev-library",
      "url": "https://github.com/jihedbfr-art/dev-library",
      "kind": "knowledge-base",
      "domains": [
        "ai",
        "cheatsheets",
        "cybersecurity",
        "devsecops",
        "knowledge-base",
        "learning",
        "algorithms",
        "awesome",
        "cloud",
        "computer-science",
        "encyclopedia",
        "networking",
        "programming",
        "software-engineering",
        "system-design"
      ],
      "entry_points": {
        "human": "README.md",
        "agent": "README.md"
      },
      "languages": [
        "en",
        "fr"
      ],
      "status": "active"
    },
    {
      "id": "dev-tools-workbench",
      "url": "https://github.com/jihedbfr-art/dev-tools-workbench",
      "kind": "library",
      "domains": [
        "camunda",
        "developer-tools",
        "java",
        "kafka",
        "keycloak",
        "spring-boot"
      ],
      "entry_points": {
        "human": "README.md",
        "agent": "README.md"
      },
      "languages": [
        "en",
        "fr"
      ],
      "status": "active"
    },
    {
      "id": "engineering-library",
      "url": "https://github.com/jihedbfr-art/engineering-library",
      "kind": "knowledge-base",
      "domains": [
        "ai-engineering",
        "angular",
        "architecture",
        "engineering-library",
        "java",
        "keycloak",
        "microservices",
        "spring-boot",
        "software-engineering",
        "telecom",
        "adr",
        "knowledge-base",
        "system-design"
      ],
      "entry_points": {
        "human": "README.md",
        "agent": "llms.txt"
      },
      "languages": [
        "en",
        "fr"
      ],
      "status": "active"
    },
    {
      "id": "jihed-skills-cli",
      "url": "https://github.com/jihedbfr-art/jihed-skills-cli",
      "kind": "library",
      "domains": [
        "ai-engineering",
        "cli",
        "developer-tools",
        "documentation",
        "python"
      ],
      "entry_points": {
        "human": "README.md",
        "agent": "README.md"
      },
      "languages": [
        "en",
        "fr"
      ],
      "status": "active"
    },
    {
      "id": "jihed-skills-mcp",
      "url": "https://github.com/jihedbfr-art/jihed-skills-mcp",
      "kind": "library",
      "domains": [
        "ai-agents",
        "llm-tools",
        "mcp",
        "model-context-protocol",
        "python"
      ],
      "entry_points": {
        "human": "README.md",
        "agent": "README.md"
      },
      "languages": [
        "en",
        "fr"
      ],
      "status": "active"
    },
    {
      "id": "jihedailabs-tokenlens",
      "url": "https://github.com/jihedbfr-art/jihedailabs-tokenlens",
      "kind": "library",
      "domains": [
        "ai-coding",
        "cli",
        "developer-tools",
        "privacy",
        "python",
        "token-usage"
      ],
      "entry_points": {
        "human": "README.md",
        "agent": "README.md"
      },
      "languages": [
        "en",
        "fr"
      ],
      "status": "active"
    },
    {
      "id": "jihedbfr-art",
      "url": "https://github.com/jihedbfr-art/jihedbfr-art",
      "kind": "profile",
      "domains": [
        "github-profile",
        "automation",
        "jinja2",
        "ecosystem-index",
        "agents"
      ],
      "entry_points": {
        "agent": "agents.md",
        "human": "README.md"
      },
      "languages": [
        "en",
        "fr"
      ],
      "status": "active"
    },
    {
      "id": "keycloak",
      "url": "https://github.com/jihedbfr-art/keycloak",
      "kind": "library",
      "domains": [
        "software-engineering"
      ],
      "entry_points": {
        "human": "README.md",
        "agent": "README.md"
      },
      "languages": [
        "en",
        "fr"
      ],
      "status": "active"
    },
    {
      "id": "keycloak-spi-workbench",
      "url": "https://github.com/jihedbfr-art/keycloak-spi-workbench",
      "kind": "workbench",
      "domains": [
        "authentication",
        "keycloak",
        "keycloak-spi",
        "mfa",
        "spring-boot",
        "testcontainers",
        "apache-kafka",
        "postgresql",
        "user-federation",
        "identity-and-access-management",
        "java",
        "oauth2",
        "oidc"
      ],
      "entry_points": {
        "human": "README.md",
        "agent": "README.md"
      },
      "languages": [
        "en",
        "fr"
      ],
      "status": "active"
    },
    {
      "id": "mcp-keycloak-guard",
      "url": "https://github.com/jihedbfr-art/mcp-keycloak-guard",
      "kind": "library",
      "domains": [
        "java",
        "keycloak",
        "mcp",
        "model-context-protocol",
        "rbac"
      ],
      "entry_points": {
        "human": "README.md",
        "agent": "README.md"
      },
      "languages": [
        "en",
        "fr"
      ],
      "status": "active"
    },
    {
      "id": "oda-learning-lab",
      "url": "https://github.com/jihedbfr-art/oda-learning-lab",
      "kind": "knowledge-base",
      "domains": [
        "bilingual",
        "education",
        "open-apis",
        "study-guide",
        "telecom"
      ],
      "entry_points": {
        "human": "README.md",
        "agent": "README.md"
      },
      "languages": [
        "en",
        "fr"
      ],
      "status": "active"
    },
    {
      "id": "openapi-sentinel",
      "url": "https://github.com/jihedbfr-art/openapi-sentinel",
      "kind": "library",
      "domains": [
        "api-governance",
        "bilingual",
        "breaking-changes",
        "linter",
        "openapi",
        "python",
        "swagger",
        "telecom",
        "sarif"
      ],
      "entry_points": {
        "human": "README.md",
        "agent": "README.md"
      },
      "languages": [
        "en",
        "fr"
      ],
      "status": "active"
    },
    {
      "id": "spring-keycloak-toolkit",
      "url": "https://github.com/jihedbfr-art/spring-keycloak-toolkit",
      "kind": "library",
      "domains": [
        "jwt",
        "keycloak",
        "oauth2",
        "rfc7807",
        "spring-boot",
        "spring-security",
        "java",
        "oidc",
        "resource-server"
      ],
      "entry_points": {
        "human": "README.md",
        "agent": "README.md"
      },
      "languages": [
        "en",
        "fr"
      ],
      "status": "active"
    },
    {
      "id": "telecom-architecture",
      "url": "https://github.com/jihedbfr-art/telecom-architecture",
      "kind": "library",
      "domains": [
        "5g",
        "architecture",
        "bss",
        "microservices",
        "oss",
        "telecom",
        "tmforum"
      ],
      "entry_points": {
        "human": "README.md",
        "agent": "README.md"
      },
      "languages": [
        "en",
        "fr"
      ],
      "status": "active"
    }
  ]
}
